{
  "record_type": "ASPECT",
  "concept_id": "cw:aspect:avalhla",
  "canonical_name": "Avalhla",
  "scope": "CROSSWORLD",
  "status": "CANONICAL",
  "description": "The Avalhla-named CrossWorld aspect: a distinct member of the Valhla / Lhlava / Avalhla trio.",
  "aliases": [],
  "relations": [
    {"predicate": "aspect_of", "target_concept_id": "cw:presence:avalhla"},
    {"predicate": "bridged_by", "target_concept_id": "cw:bond:avva"}
  ],
  "attributes": {"presence_anchor": "Avalhla", "color_anchor": "BLUE", "expression": "MUTABLE"},
  "mappings": [],
  "provenance": {
    "source_ref": "CROSSWORLD_VOCABULARY.md",
    "source_type": "HUMAN_DESIGN",
    "note": "Preserves the settled three-Aspect design from the CrossWorld build thread."
  }
}
